{
  "$schema": "https://json-schema.org/draft/2020-12/schema",
  "$id": "https://invatrace.local/schemas/catalogue-manifest.schema.json",
  "title": "InvaTrace catalogue manifest",
  "type": "object",
  "additionalProperties": false,
  "required": [
    "schema_version",
    "catalogue_version",
    "content_version",
    "model_version",
    "last_reviewed",
    "generated_at",
    "assets",
    "files"
  ],
  "properties": {
    "$schema": { "type": "string" },
    "schema_version": { "type": "string", "const": "invatrace.catalogue.manifest.v2" },
    "catalogue_version": { "type": "string", "pattern": "^\\d+\\.\\d+\\.\\d+$" },
    "content_version": { "type": "string", "pattern": "^\\d+\\.\\d+\\.\\d+$" },
    "model_version": { "type": "string", "minLength": 1 },
    "last_reviewed": { "type": "string", "format": "date" },
    "generated_at": { "type": "string", "format": "date-time" },
    "assets": {
      "type": "array",
      "items": {
        "type": "object",
        "additionalProperties": false,
        "required": ["species_id", "url", "sha256", "byte_length", "review_status"],
        "properties": {
          "species_id": { "type": "string", "pattern": "^[a-z0-9]+(?:-[a-z0-9]+)+$" },
          "url": { "type": "string", "pattern": "^/reference-images/" },
          "sha256": { "type": "string", "pattern": "^[0-9a-f]{64}$" },
          "byte_length": { "type": "integer", "minimum": 1 },
          "review_status": { "enum": ["approved", "provenance_pending"] },
          "creator": { "type": "string", "minLength": 1 },
          "licence": { "type": "string", "minLength": 1 },
          "licence_url": { "type": "string", "format": "uri" },
          "source_title": { "type": "string", "minLength": 1 },
          "source_url_or_identifier": { "type": "string", "minLength": 1 },
          "retrieved_at": { "type": "string", "format": "date" },
          "reviewed_at": { "type": "string", "format": "date" },
          "attribution_text": { "type": "string", "minLength": 10 }
        },
        "allOf": [
          {
            "if": { "properties": { "review_status": { "const": "approved" } } },
            "then": {
              "required": [
                "creator",
                "licence",
                "licence_url",
                "source_title",
                "source_url_or_identifier",
                "retrieved_at",
                "reviewed_at",
                "attribution_text"
              ]
            }
          }
        ]
      }
    },
    "files": {
      "type": "object",
      "additionalProperties": false,
      "required": ["approved-species.json", "plant-status.json", "plant-guidance.json", "reference-images.json", "catalogue-details.json"],
      "properties": {
        "approved-species.json": { "$ref": "#/$defs/fileEntry" },
        "plant-status.json": { "$ref": "#/$defs/fileEntry" },
        "plant-guidance.json": { "$ref": "#/$defs/fileEntry" },
        "reference-images.json": { "$ref": "#/$defs/fileEntry" },
        "catalogue-details.json": { "$ref": "#/$defs/fileEntry" }
      }
    }
  },
  "$defs": {
    "fileEntry": {
      "type": "object",
      "additionalProperties": false,
      "required": ["sha256", "byte_length", "schema_version"],
      "properties": {
        "sha256": { "type": "string", "pattern": "^[0-9a-f]{64}$" },
        "byte_length": { "type": "integer", "minimum": 1 },
        "schema_version": { "type": "string", "minLength": 1 },
        "record_count": { "type": "integer", "minimum": 0 }
      }
    }
  }
}
